Required	Provenzano, Paolo P., Carlos Cuevas, et al. “Enzymatic Targeting of the Stroma Ablates Physical Barriers to Treatment of Pancreatic Ductal Adenocarcinoma.” Cancer Cell 21, no. 3 (2012): 418–29.
Required	Provenzano, P. P., and S. R. Hingorani. “Hyaluronan, Fluid Pressure, and Stromal Resistance in Pancreas Cancer.” British Journal of Cancer 108, no. 1 (2013): 1–8.
Required	Chauhan, Vikash P., Yves Boucher, et al. “Compression of Pancreatic Tumor Blood Vessels by Hyaluronan is Caused by Solid Stress and Not Interstitial Fluid Pressure.” Cancer Cell 26, no. 1 (2014): 14–15.
Optional	Drubin, David G. “Any Jackass can Trash a Manuscript, But It Takes Good Scholarship to Create One (How MBoC Promotes Civil and Constructive Peer Review).” Molecular Biology of the Cell 22, no. 5 (2011): 525–27.
Optional	Neill, Ushma S. “How to Write an Effective Referee Report.” The Journal of Clinical Investigation 119, no. 5 (2009): 1058–60.
Optional	Truskey, George A., Fan Yuan, and David F. Katz. Transport Phenomena in Biological Bystems. Pearson, 2009. ISBN: 9780131569881.
