Required	Grier, Nathaniel. “Formulating a Mathematical Program: An Overview.” 2001. (Cambridge, MA: 1.224 Carrier Systems Tutorial, MIT)
Required	Blais, J. Y., J. Lamont, and J. M. Rousseau. “The HASTUS Vehicle and Manpower Scheduling System at the Societe de transport de la Communaute urbaine de Montreal.” Interfaces 20, no. 1 (1990)
Required	Odoni, A. R., J. -M. Rousseau, and N. H. M. Wilson. “Models in Urban and Air Transportation.” Chapter 5 in Operations Research and the Public Sector, Handbooks in Operations Research and Management Science. Vol. 6. Edited by S. M. Pollock, M. H. Rothkopf, and A. Barnett. 1994
Required	Shen, S. “Vehicle and Crew Scheduling.” 2000. (Cambridge, MA: 1.224 Carrier Systems Case Study, MIT).
Required	Barnhart, C., A. M. Cohn, E. L. Johnson, D. Klabjan, G. L. Nemhauser, and P. H. Vance. “Airline Crew Scheduling.” In Handbook of Transportation Science. 2nd ed. Edited by Randolph W. Hall. Norwell, MA: Kluwer Academic Publishers, November 2001.
Required	Cohn, A. “Making the Trade-off Between Optimality and Tractability When Solving Large Transportation Models: A Case Study on the Airline Industry.” 2000. (Cambridge, MA: 1.224 Carrier Systems Case Study, MIT).
Optional	Bradley, S. P., A. C. Hax, and T. L. Magnanti. Applied Mathematical Programming. Reading, MA: Addison-Wesley, 1977. ISBN: 020100464X.
Optional	Winston, W. L. Operations Research: Applications and Algorithms. Belmont, California: Wadsworth Publishing Company, 1994. ISBN: 0534380581.
