Optional	McCloud, Scott. Understanding Comics: The Invisible Art. New York, NY: Harper Paperbacks, 1994. ISBN: 9780060976255.
Optional	Norman, Donald. Emotional Design: Why We Love (or Hate) Every Day Things. New York, NY: Basic Books, 2005. ISBN: 9780465051366.
Optional	Ulrich, Karl T., and Steven D. Eppinger. Product Design and Development. 3rd ed. Boston, Mass: McGraw-Hill/Irwin, 2003. ISBN: 9780072471465.
Optional	Ashby, Michael, and Kara Johnson. Materials and Design: The Art and Science of Material Selection in Product Design. Boston, MA: Butterworth-Heinemann, 2002. ISBN: 9780750655545.
Optional	Sutton-Smith, Brian. Toys as Culture. New York, NY: Gardner Press, 1986. ISBN: 9780898761054.
Optional	Bee, Helen L., and Denise Roberts Boyd. The Developing Child. 10th ed. Boston, MA: Allyn & Bacon, 2003. ISBN: 9780205340989.
