Optional	Ely, Jeffrey C., and Tanjim Hossain. “Sniping and Squatting in Auction Markets.” American Economic Journal: Microeconomics 1, no. 2 (August 2009): 68-94
Optional	Chapman, James T. E., David McAdams, and Harry Paarsch. “Bounding Best-Response Violations in Discriminatory Auctions with Private Values.” Mimeograph, Duke University, July 2006
Required	Roth, Alvin E., and Elliot Peranson. “The Redesign of the Matching Market for American Physicians: Some Engineering Aspects of Economic Design.” American Economic Review 89, no. 4 (September 1999): 748-780
Required	Kojima, Fuhito, and Parag Pathak. “Incentives and Stability in Large Two-Sided Matching Markets.” American Economic Review 99, no. 3 (June 2009): 608-627
Required	Kojima, Fuhito, Parag Pathak, and Alvin E. Roth. “Stability and Incentives in Matching with Couples.” Mimeograph, Stanford University, 2009
Required	Roberts, Donald John, and Andrew Postlewaite. “The Incentives for Price-Taking Behavior in Large Exchange Economies.” Econometrica 44, no. 1 (January 1976): 115-127
Required	Rustichini, Aldo, Mark A. Satterthwaite, and Steven R. Williams. “Convergence to Efficiency in a Simple Market with Incomplete Information.” Econometrica 62, no. 1 (September 1994): 1041-1063
Required	Satterthwaite, Mark A., and Steven R. Williams. “The Optimality of a Simple Market Mechanism.” Econometrica 70, no. 5 (September 2002): 1841-1863
Required	Satterthwaite, Mark A. “Strategy-Proofness and Markets.” Social Choice and Welfare 18, no. 1 (2001): 37-58
Optional	Gresik, Thomas, and Mark A. Satterthwaite. “The Rate of Which a Simple Market Becomes Efficient as the Number of Traders Increases: An Asymptotic Result for Optimal Trading Mechanisms.” Journal of Economic Theory 48, no. 1 (June 1989): 304-332. Also available as Center for Mathematical Studies in Economics and Management Science Discussion Paper No. 708, Northwestern University, January 1985
Optional	Pesendorfer, Wolfgang, and Jeroen Swinkels. “The Loser’s Curse and Information Aggregation in Common Value Auctions.” Econometrica 65, no. 6 (November 1997): 1247-1282
Optional	“Efficiency and Information Aggregation in Auctions.” American Economic Review 90, no. 3 (June 2000): 499-525
Optional	Wilson, Robert B. “A Bidding Model of Perfect Competition.” Review of Economic Studies 44, no. 3 (October 1977): 511-518
Optional	Milgrom, Paul. “A Convergence Theorem for Competitive Bidding with Differential Information.” Econometrica 47, no. 3 (May 1979): 679-688
Optional	Swinkels, Jeroen. “Efficiency of Large Private Value Auctions.” Econometrica 69, no. 1 (January 2001): 37-68
Optional	Perry, Motty, and Philip J. Reny. “Toward a Strategic Foundation for Rational Expectations Equilibrium.” Econometrica 74, no. 5 (September 2006): 1231-1269
Optional	Wilson, Robert B. “Incentive Efficiency of Double Auctions.” Econometrica 53, no. 5 (September 1985): 1101-1115
Optional	Cripps, Martin, and Jeroen Swinkels. “Efficiency of Large Double Auctions.” Econometrica 74, no. 1 (January 2006): 47-92
Optional	Fudenberg, Drew, Markus Mobius, and Adam Szeidl. “Existence of Equilibrium in Large Double Auctions.” Journal of Economic Theory 133, no. 1 (March 2007): 550-567
Optional	McLean, Richard, and Andrew Postlewaite. “Informational Size and Incentive Compatibility.” Econometrica 70, no. 6 (November 2002): 2421-2453
Optional	Jackson, Matthew, and Ilan Kremer. “The Relevance of a Choice of Auction Format in a Competitive Environment.” Review of Economic Studies 73, no. 4 (October 2006): 961-981. Also available as Division of the Humanities and Social Sciences Working Paper No. 1190, California Institute of Technology, January 2004
Required	Casella, Alessandra. “Storable Votes.” Games and Economic Behavior 51, no. 2 (May 2005): 391-419
Required	Jackson, Matthew, and Hugo Sonnenschein. “Overcoming Incentive Constraints by Linking Decisions.” Econometrica 75, no. 1 (January 2007): 241-257
Optional	Börgers, Tilman. “Costly Voting.” American Economic Review 94, no. 1 (March 2004): 57-66
Optional	Börgers, Tilman, and Peter Postl. “Efficient Compromising.” Journal of Economic Theory 114, no. 5 (September 2009): 2057-2076
Optional	Hortalla-Vallve, Rafael. “Qualitative Voting.” Economics Series Working Papers No. 320, Department of Economics, University of Oxford, 2007
Optional	Segal, Ilya. “Communication in Economic Mechanisms.” Chapter 6 in Advances in Economics and Econometrics: Theory and Applications, Ninth World Congress. Vol. 1. Edited by Richard Blundell, Whitney K. Newey, and Torsten Persson. New York, NY: Cambridge University Press, 2006, pp. 222-268. ISBN: 9780521692083
Optional	“The Communication Requirements of Social Choice Rules and Supporting Budget Sets.” Journal of Economic Theory 136, no. 1 (September 2007): 341-378
Optional	Nisan, Noam, and Ilya Segal. “The Communication Requirements of Efficient Allocations and Supporting Prices.” Journal of Economic Theory 129, no. 1 (July 2006): 192-224
Optional	Segal, Ilya. “Nash Implementation with Little Communication.” Theoretical Economics 5, no. 1 (March 2010): 51-71
Required	Athanasoulis, Stefano, and Robert Shiller. “World Income Components: Measuring and Exploiting Risk Sharing Opportunities.” American Economic Review 91, no. 4 (September 2001): 1031-1054
Required	“The Significance of the Market Portfolio.” Review of Financial Studies 13, no. 2 (2000): 301-329
Required	Acharya, Viral, and Alberto Bisin. “Centralized versus Over the Counter Markets.” Working paper, New York University, May 2009
Optional	Cabrales, Antonio, Antoni Calvo-Armengol, and Matthew Jackson. “La Crema: Fire Insurance in a Village Economy of Modern Day Europe.” Journal of Political Economy 111, no. 2 (2003): 425-458
Optional	Dekel, Eddie, Matthew Jackson, and Asher Wolinsky. “Vote Buying: General Elections.” Journal of Political Economy 116, no. 2 (April 2008): 351-380
Optional	Pycia, Marek. “Many-to-One Matching without Substitutability.” Industrial Performance Center (IPC) Working Paper No. 05-008, Massachusetts Institute of Technology, November 2005
Optional	Yenmez, M. Bumin. “Incentive Compatible Market Design with an Application to Matching with Wages.” Mimeograph, Stanford Graduate School of Business, Stanford University, November 2009
Optional	Lee, Soohyung. “Marriage and Online Mate-Search Services: Evidence from South Korea.” Mimeograph, Department of Economics, University of Maryland, October 2009
