Required	Vogel, Steven. Cats’ Paws and Catapults: Mechanical Worlds of Nature and People. W. W. Norton & Company, 2000. ISBN: 9780393319903.
Required	Triantafyllou, Michael S., and George S. Triantafyllou. “An Efficient Swimming Machine.” Scientific American 272, no. 3 (1995): 64–71.
Required	Taylor, Graham K., Robert L. Nudds, et al. “Flying and Swimming Animals Cruise at a Strouhal Number Tuned for High Power Efficiency.” Nature 425, no. 6959 (2003): 707–11.
Required	Holland, John H. “Genetic Algorithms.” Scientific American 267, no. 1 (1992): 66–72.
Required	Carpenter, Jennifer. “May the Best Analyst Win.” Science 331, no. 6018 (2011): 698–9.
Required	Woolley, Anita Williams, Christopher F. Chabris, et al. “Evidence for a Collective Intelligence Factor in the Performance of Human Groups.” Science 330, no. 6004 (2010): 686–8.
Required	Chittka, Lars, and Alex Mesoudi. “Insect Swarm Intelligence.” Science 331, no. 6016 (2011): 401–2.
