Required	Ratner, Buddy D., et al. Biomaterials Science: An Introduction to Materials in Medicine. 2nd ed. Burlington, MA: Academic Press, 2004. ISBN: 9780125824637.
Required	Whitesides, G. M., and A. P. Wong. “The Intersection of Biology and Materials Science.” MRS Bulletin 31 (2006): 19-27.
Required	Jacobs, J. J., J. L. Gilbert, and R. M. Urban. “Corrosion of Metal Orthopaedic Implants.” Journal of Bone and Joint Surgery 80A (1998): 268-282.
Required	Ikada, Y., and H. Tsuji. “Biodegradable Polyesters for Medical and Ecological Applications.” Macromolecular Rapid Communications 21 (2000): 117-132.
Required	Marazuela, M. D., and M. C. Moreno-Bondi. “Fiber-optic Biosensors - An Overview.” Analytical and Bioanalytical Chemistry 372 (2002): 664-682.
Required	Duncan, Ruth. “The Dawning Era of Polymer Therapeutics.” Nature Reviews Drug Discovery 2 (2003): 347-360.
