Optional	Stockman, Steve. How to Shoot Video That Doesn’t Suck: Advice to Make Any Amateur Look Like a Pro. Workman Publishing Company, 2011. ISBN: 9780761163237
Optional	Murch, Walter. In the Blink of an Eye: A Perspective on Film Editing. Silman-James Press, 2001. ISBN: 9781879505629
Optional	Voltz, Stephen, and Fritz Grobe. The Viral Video Manifesto: Why Everything You Know is Wrong and How to Do What Really Works. McGraw-Hill Education, 2012. ISBN: 9780071803380
Required	Murch, Walter. In the Blink of an Eye: A Perspective on Film Editing. Silman - James Press, 2001. ISBN: 9781879505629
Optional	Wiggins, Grant J. and Jay McTighe. Understanding by Design. 2nd ed. ASCD, 2005. ISBN: 9780131950849
Optional	Wade, Nicholas. “Ice Age Ancestry May Keep Body Warmer and Healthier,” New York Times, January 9, 2004
Optional	“Mind Over Matter? Core Body Temperature Controlled by the Brain,” National University of Singapore, April 8, 2013
Optional	Koxa, Matthijs, et al. “Voluntary Activation of the Sympathetic Nervous System and Attenuation of the Innate Immune Response in Humans.” Proceedings of the National Academy of Sciences of the United States of America 111, no. 20 (2014): 7379–84
