Required	Edwards, Steve. Photography: A Very Short Introduction. New York, NY: Oxford University Press, 2006. ISBN: 9780192801647
Required	Wright, Richard. 12 Million Black Voices. New York, NY: Basic Books, 2002. ISBN: 9781560254461
Required	Sontag, Susan. Regarding the Pain of Others. New York, NY: Picador, 2004. ISBN: 9780312422196
Optional	Lenman, Robin. The Oxford Companion to the Photograph. New York, NY: Oxford University Press, 2005. ISBN: 9780198662716
Optional	Frizot, Michel. A New History of Photography. Köln, Germany: Könemann, 1998. ISBN: 9783829013284
Optional	Marien, Mary Warner. Photography: A Cultural History. Upper Saddle River, NJ: Pearson Prentice Hall, 2006. ISBN: 9780132219068
Required	Wells, Physiognomy, pp. 162-165, 168-171, 192-195, 344-345, 360-361, and 382-383
Required	Hamilton & Hargreaves, The Beautiful and the Damned, all
Required	Batchen, Geoffrey. “Vernacular Photographies.” History of Photography 24 (Autumn 2000): 262-269
Required	Katriel, Tamar, and Thomas Farrell. “Scrapbooks as Cultural Texts: An American Art of Memory.” Text and Performance Quarterly 11 (January 1991): 1-17
Required	Frizot, New History, chapter 41, “Rituals and Customs.”
Required	Jacobbi, Marianne. “Deleting Him.” The Boston Globe, January 13, 2008, p. 38
Required	Amir, “From Memorial Books to Invaluable Historical Documentation.”
Required	Simmonds, Posy. “Every Picture Tells a Story.” p. 212 in Lenman, Oxford Companion
Required	Gladwell, Malcolm. “The Picture Problem.” The New Yorker, December 13, 2004, pp. 74-81
Required	Chéroux, The Perfect Medium, pp. 20-23 and 29-34 (read); pp. 73-78 and 92-94 (skim)
Required	Harvey, Photography and Spirit, pp. 56-69, 70-75, and 80-86
Required	Brower, Kenneth. “Photography in the Age of Falsification.” The Atlantic (May 1998): 92-111
Required	Guimond, American Photography and the American Dream, chapter 4
Optional	Levine, “The Historian and the Icon,” and Trachtenberg, “From Image to Story.” In Documenting America, pp. 15-71. (optional)
Required	Mitchell, “Orientalism and the Exhibitionary Order.”
Required	Faris, “A Political Primer on Photography/Anthropology,” (read) and Street, “British Popular Anthropology,” (skim). In Edwards, Anthropology and Photography
Required	Lutz, Catherine, and Jane Collins. “The Photograph as an Intersection of Gazes: the Example of National Geographic.” Visual Anthropology Review 7 (1991): 143-149
Required	Poole, Deborah. “An Excess of Description: Ethnography, Race, and Visual Technologies.” Annual Review of Anthropology 34 (2005): 159-179
Required	Frizot, New History, chapter 30, “The Way Life Goes,” and chapter 33, “The Involvement of the Photojournalist.”
Optional	Dunaway, “Nature on the Coffee Table,” (required) and “Thoreau with a Camera,” (optional). In Natural Visions
Required	Ferrato, “Living with the Enemy: Domestic Violence.”
Required	Levi-Strauss, “The Documentary Debate,” and “Photography and Propaganda.” In Between the Eyes
Required	Collier, Visual Anthropology, pp. 19-28, 44-63, and 77-97
Required	Bateson & Mead, Balinese Character, pp. xi-xvi, 1, 6-8, 13-23, 64-65, 78-79, 86-87, 96-97, 100-101, 104-105, and 120-121
Required	Morath, “Pamplona Bullfight,” and Smith, “A Country Doctor.” In Boot, Magnum Stories
Required	“Spanish Village.” pp. 72-81 in Time - Photojournalism
Required	Benjamin, “The Work of Art in the Age of Mechanical Reproduction,” and Manovich, “The Paradoxes of Digital Photography.” In Wells, The Photography Reader
Required	Collins, Lauren. “Pixel Perfect.” The New Yorker, May 12, 2008
Required	Amir, Michlean J. “From Memorial Books to Invaluable Historical Documentation.” In Wolfson, Laurel, and Barbara Leff. Proceedings of the 36th Annual Convention of the Association of Jewish Libraries. La Jolla, CA: AJL, 2001
Required	Banks, Marcus. Visual Methods in Social Research. Thousand Oaks, CA: Sage, 2001. ISBN: 9780761963646
Required	Bateson, Gregory, and Margaret Mead. Balinese Character. New York, NY: New York Academy of Sciences, 1942
Required	Boot, Chris. Magnum Stories. New York, NY: Phaidon, 2004. ISBN: 9780714842455
Required	Chéroux, Clement, et al. The Perfect Medium. New Haven, CT: Yale University Press, 2005. ISBN: 9780300111361
Required	Collier, John, Jr., and Malcolm Collier. Visual Anthropology. Albuquerque, NM: University of New Mexico, 1986. ISBN: 9780826308993
Required	Dunaway, Finis. Natural Visions: The Power of Images in American Environmental Reform. Chicago, IL: University of Chicago Press, 2008. ISBN: 9780226173269
Required	Edwards, Elizabeth. Anthropology and Photography, 1860-1920. New Haven, CT: Yale University Press, 1994. ISBN: 9780300059441
Required	Ferrato, Donna. “Living with the Enemy: Domestic Violence.” In Light, Ken. Witness in Our Time: Working Lives of Documentary Photographers. Washington, DC: Smithsonian Institution Press, 2000. ISBN: 9781560989486
Required	Fleischhauer, Carl, and Beverly Brannan. Documenting America. Berkeley, CA: University of California Press, 1988. ISBN: 9780520062214
Required	Goffman, Erving. Gender Advertisements. Cambridge, MA: Harvard University Press, 1979. ISBN: 9780674341913
Required	Goldberg, Vicki. “Documenting Poverty.” In Light Matters: Writings on Photography. New York, NY: Aperture, 2005. ISBN: 9781931788632
Required	Guimond, James. American Photography and the American Dream. Chapel Hill, NC: University of North Carolina Press, 1991. ISBN: 9780807843086
Required	Hamilton, Peter, and Roger Hargreaves. The Beautiful and the Damned: The Creation of Identity in Nineteenth-Century Photography. Burlington, VT: Lund Humphries, 2001. ISBN: 9780853318217
Required	Harvey, John. Photography and Spirit. London, England: Reaktion Press, 2007. ISBN: 9781861893246
Required	Kemp, Martin. “‘A Perfect and Faithful Record’: Mind and Body in Medical Photography Before 1900.” Chapter 5 in Thomas, Ann. Beauty of Another Order: Photography in Science. New Haven, CT: Yale University Press, 1997. ISBN: 9780300073409
Required	King, David. The Commissar Vanishes: The Falsification of Photographs and Art in Stalin’s Russia. New York, NY: Metropolitan Books, 1997. ISBN: 9780805052947
Required	Kristof, Nicholas D. “Save the Darfur Puppy.” New York Times, May 10, 2007
Required	Kuhn, Annette. “Remembrance.” In Illuminations: Women Writing on Photography from the 1850s to the Present. Edited by Liz Heron and Val Williams. Durham, NC: Duke University Press, 1996. ISBN: 9780822317845
Required	Lange, Dorothea, and Paul Taylor. An American Exodus: A Record of Human Erosion. New Haven, CT: Yale University Press, 1969
Required	Levi-Strauss, David. “The Documentary Debate,” and “Photography and Propaganda.” In Between the Eyes: Essays on Photography. New York, NY: Aperture, 2005. ISBN: 9781931788106
Required	Malcolm, Janet. “Certainties and Possibilities.” In Diana & Nikon: Essays on Photography. New York, NY: Aperture, 1997. ISBN: 9780893817275
Required	Mitchell, Timothy. “Orientalism and the Exhibitionary Order.” In Colonialism and Culture. Edited by Nicholas Dirks. Ann Arbor, MI: University of Michigan Press, 1992. ISBN: 9780472094349
Required	Parker, Ann, and Avon Neal. Los Ambulantes: Itinerant Photographers of Guatemala. Cambridge, MA: MIT Press, 1984. ISBN: 9780262660532
Required	Pink, Sarah. Doing Visual Ethnography. Thousand Oaks, CA: Sage, 2001. ISBN: 9780761960546
Required	Severson, Kim. “Upton Sinclair, Now Playing on YouTube.” New York Times, March 12, 2008
Required	Sontag, Susan. “In Plato’s Cave.” In On Photography. New York, NY: Picador, 2001. ISBN: 9780312420093
Required	Sprague, Stephen. “Yoruba Photography: How the Yoruba See Themselves.” In Pinney, Christopher, and Nicolas Peterson. Photography’s Other Histories. Durham, NC: Duke University Press, 2003. ISBN: 9780822331261
Required	Time Life Library of Photography - Photojournalism. New York, NY: Time-Life Books, 1971
Required	Timmons, Heather, and J. Adam Huggins. “New York Manhole Covers, Forged Barefoot in India.” New York Times, November 26, 2007
Required	Trachtenberg, Alan. “Illustrious Americans.” Chapter 1 in Reading American Photographs. New York, NY: Hill and Wang, 1990. ISBN: 9780374522490
Required	Wells, Liz. The Photography Reader. New York, NY: Routledge, 2002. ISBN: 9780415246613
Required	Wells, Samuel. New Physiognomy or Signs of Character as Manifested through Temperament. Whitefish, MT: Kessinger, LLC, 2007. ISBN: 9780548001523
Optional	Adams, Ansel, and Nancy Newhall. This is the American Earth. San Francisco, CA: Sierra Club, 1960
Optional	Agee, James, and Walker Evans. Let Us Now Praise Famous Men: the American Classic, in Words and Pictures, of Three Tenant Families in the Deep South. Boston, MA: Houghton Mifflin, 2000. ISBN: 9780395957714
Optional	Alexandra of Denmark. Queen Alexandra’s Christmas Gift Book. London, England: The Daily Telegraph, 1908
Optional	Bassil, Karl, Zeina Maasri, Akram Za’atari, and Walid Radd. Mapping Sitting: On Portraiture and Photography. London, England: Mind the Gap/Arab Image Foundation, 2005. ISBN: 9789953004129
Optional	Batchen, Geoffrey. Forget Me Not: Photography & Remembrance. New York, NY: Princeton Architectural Press, 2004. ISBN: 9781568984506
Optional	Bogdan, Robert, and Todd Weseloh. Real Photo Postcard Guide: the People’s Photography. Syracuse, NY: Syracuse University Press, 2006. ISBN: 9780815608516
Optional	Caldwell, Erskine, and Margaret Bourke-White. You Have Seen Their Faces. Atlanta, GA: University of Georgia Press, 1995. ISBN: 9780820316925
Optional	Capa, Robert. Death in the Making. New York, NY: Civici-Friede, 1938
Optional	Chambi, Martín. Martín Chambi, Photographs 1920-1950. Washington, DC: Smithsonian Press, 1993. ISBN: 9781560982449
Optional	Cole, Ernest. House of Bondage. New York, NY: Random House, 1967
Optional	Danforth, Loring, and Alexander Tsiaris. The Death Rituals of Rural Greece. Princeton, NJ: Princeton University Press, 1982. ISBN: 9780691000275
Optional	Davidson, Bruce. Portraits. New York, NY: Aperture, 2005. ISBN: 9780893818517
Optional	Emmet, Herman. Fruit Tramps: A Family of Migrant Farmworkers. Albuquerque, NM: University Of New Mexico Press, 1989. ISBN: 9780826311191
Optional	Ferrato, Donna. Living with the Enemy. New York, NY: Aperture, 2005. ISBN: 9780893814809
Optional	Fleischauer, Carl, and Beverly Brannan. Documenting America, 1935-1943. Berkeley, CA: University of California Press, 1988. ISBN: 9780520062214
Optional	Gardner, Robert, and Karl Heider. Gardens of War: Life and Death in the New Guinea Stone Age. New York, NY: Random House, 1968
Optional	Greenfield, Patricia Marks. Weaving Generations Together: Evolving Creativity in the Maya of Chiapas. Santa Fe, NM: School of American Research Press, 2004. ISBN: 9781930618282
Optional	Greenough, Sarah, et al. The Art of the American Photograph, 1888-1978: From the Collection of Robert E. Jackson. Princeton, NJ: Princeton University Press, 2007. ISBN: 9780691133683
Optional	Guzmán Meza, Emiliano. Ixim; Maíz; Corn. Chiapas, Mexico: CIESAS, 2004. ISBN: 9789684964884
Optional	Hamilton, Peter, and Roger Hargreaves. Beautiful and the Damned: The Creation of Identity in Nineteenth-Century Photography. Burlington, VT: Lund Humphries, 2001. ISBN: 9780853318217
Optional	Kayser, Alex. Heads. New York, NY: Abbeville Press, 1997. ISBN: 9780896595248
Optional	King, David. The Commissar Vanishes. New York, NY: Metropolitan, 1997. ISBN: 9780805052947
Optional	Kozloff, Max. The Theatre of the Face: Portrait Photography Since 1900. New York, NY: Phaidon, 2007. ISBN: 9780714843728
Optional	Kugelmass, Jack, and Jonathan Boyarin. From a Ruined Garden: The Memorial Books of Polish Jewry. Bloomington, IN: Indiana University Press, 1998. ISBN: 9780253211873
Optional	Lartigue, J. H. Boyhood Photographs of J. H. Lartigue: The Family Album of a Gilded Age. Lausanne, Switzerland: Guichard, 1966. ISBN: 9780106613618
Optional	Lopez Diaz, Xunka’. Mi hermanita Cristina, una niña chamula / My little sister Cristina, a chamula girl. Mexico City, Mexico: CIESAS, 2000
Optional	Lyman, Christopher. The Vanishing Race, and Other Illusions: Photographs of Indians by Edward S. Curtis. Washington, DC: Smithsonian Press, 1982. ISBN: 9780394710297
Optional	MacLeish, Archibald. Land of the Free. New York, NY: Harcourt Brace, 1938
Optional	Maybury-Lewis, David, and James Howe. The Indian Peoples of Paraguay: Their Plight and Their Prospects. Cambridge, MA: Cultural Survival Special Report #2, 1980
Optional	Parker, Ann, and Avon Neal. Los Ambulantes. Cambridge, MA: MIT Press, 1982. ISBN: 9780262160865
Optional	Penn, Irving. Passage: A Work Record. New York, NY: Knopf, 1991. ISBN: 9780679404910
Optional	Peterkin, Julia, and Doris Ulmann. Roll, Jordan, Roll. New York, NY: Ballou, 1933
Optional	Plowden, David. The Hand of Man on America. New York, NY: Dodd, Mead, 1973. ISBN: 9780856990779
Optional	Reinhardt, Mark, et al. Beautiful Suffering: Photography and the Traffic in Pain. Chicago, IL: University of Chicago Press, 2007. ISBN: 9780226709505
Optional	Riefenstahl, Leni. The Last of the Nuba. New York, NY: St. Martin’s Press, 1995. ISBN: 9780312136420
Optional	Rockefeller, Michael, and Kevin Bubriski. Michael Rockefeller: New Guinea Photographs, 1961. Salem, MA: Peabody Essex Museum, 2007. ISBN: 9780873658065
Optional	Salgado, Sebastião. An Uncertain Grace. New York, NY: Aperture, 2005. ISBN: 9780893814212
Optional	Sander, August. Men Without Masks: Faces of Germany 1910-1938. Greenwich, CT: New York Graphic Society, Ltd., 1973. ISBN: 9780821205334
Optional	Sills, Vaughn. One Family. Athens, GA: University of Georgia Press, 2001. ISBN: 9780820321998
Optional	Silverman, Kenneth. Houdini!!!: The Career of Ehrich Weiss. New York, NY: Harper Collins, 1997. ISBN: 9780060928629
Optional	Smith, W. Eugene, and Aileen Smith. Minamata. Tucson, AZ: Center for Creative Photography, 1981. ISBN: 9780938262053
Optional	Snyder, Stephanie, et al. Snapshot Chronicles. New York, NY: Princeton Architectural Press, 2006. ISBN: 9781568985572
Optional	Sorenson, Richard. The Edge of the Forest: Land, Childhood and Change in a New Guinea Protoagricultural Society. Washington, DC: Smithsonian Institution Press, 1976. ISBN: 9780874748758
Optional	Szarkowski, John, et al. The Photographer’s Eye. New York, NY: Museum of Modern Art, 2007. ISBN: 9780870705274
Optional	Thomas, Ann. Beauty of Another Order: Photography & Science. New Haven, CT: Yale University Press, 1997. ISBN: 9780300073409
Optional	Wells, Samuel R. New Physiognomy, or, Signs of Character, as Manifested Through Temperament and External Forms and Especially in the Human Face Divine. Whitefish, MT: Kessinger LLC, 2007. ISBN: 9780548001523
Optional	Willumson, Glenn Gardner. W. Eugene Smith and the Photographic Essay. Cambridge, England: Cambridge University Press, 1992. ISBN: 9780521414647
Optional	Wright, Stephen, and Paul Wombell. Hashem El Madani: Studio Practices. London, England: Mind the Gap/Arab Image Foundation, 2005. ISBN: 9789953003238
Optional	Young, Michael. Malinowski’s Kiriwina. Chicago, IL: University of Chicago Press, 1998. ISBN: 9780226876504
