Required	Knowles, J. K. Linear Vector Spaces and Cartesian Tensors. New York, NY: Oxford University Press, 1998. ISBN: 9780195112542
Required	Abeyaratne, Rohan. A Brief Review of Some Mathematical Preliminaries. Volume 1 in Lecture Notes on the Mechanics of Elastic Solids
Optional	Gel’fand, I. M. Lectures on Linear Algebra. New York, NY: Dover, 1989. ISBN: 9780486660820
Optional	Halmos, P. R. Finite Dimensional Vector Spaces. Princeton, NJ: Van Nostrand-Reinhold, 1958. ISBN: 9780387900933
Optional	Gel’fand, I. M., and S. V. Fomin. Calculus of Variations. Englewood Cliffs, NJ: Prentice Hall, 1963
Optional	Giaquinta, M., and S. Hilderbrandt. Calculus of Variations I. New York, NY: Springer, 1996. ISBN: 9780387506258
Optional	Troutman, J. L. Variational Calculus with Elementary Convexity. New York, NY: Springer-Verlag, 1983. ISBN: 9780387907710
